{
  "$schema": "https://json-schema.org/draft/2020-12/schema",
  "$id": "file:///C:\\Users\\shannon.peck\\Documents\\JSON-practice\\JSON_schema_project\\animal-shelter-schema\\extended-schema\\extended_schema.json",
  "title": "Animal Shelter JSON",
  "description": "Animal in an animal shelter",
  "type": "object",
  "properties": {
      "petID": {
          "description": "The unique identifier for the pet",
          "type": "integer"
      },
      "petName": {
          "description": "Name of pet",
          "type": "string"
      },
      "animalDescription": {
          "description": "description of pet",
          "$ref": "#/animalDescription"
      },
      "dateOfBirth": {
      "description": "Approximate date of birth",  
      "$ref": "#/date"
      },
      "intakeDate": {
          "description": "Date pet was taken into shelter",
          "$ref": "#/date"
      },
      "numIntakes": {
          "description": "Number of times animal has been in shelter, including current intake",
          "type": "integer",
          "minimum": 1
      }
  },
    "animalDescription": {
    "description": "Description of animal",
    "type": "object",
    "properties": {
      "species": {
        "description": "Species of animal",
        "type": "string",
        "enum": ["Feline", "Canine"]
        },
        "breed": {
          "description": "Breed(s) of pet",
          "type": "array",
          "items": {
              "type": "string"
          },
          "$ref": "#/itemReqs"
        },
        "markings": {
          "description": "Coloration and markings of pet",
          "type": "array",
          "items": {
              "type": "string"
          },
          "$ref": "#/itemReqs"
        }
    },
    "required": [ "species", "breed", "markings"]
  },
    "date": {
      "type": "string",
  "format": "date"
    },
    "itemReqs": {
      "minItems": 1,
      "uniqueItems": true
    },
  "required": ["petID", "petName", "animalDescription", "intakeDate", "numIntakes"]
}
